Name,Description,Latitude,Longitude,InfoURL,ImageURL
UCSB,A great university along the California Coast!,34.41629,-119.845991,"https://en.wikipedia.org/wiki/University_of_California, _Santa_Barbara","https://www.history.ucsb.edu/wp-content/uploads/La
goonFall20141.jpg"
Pee Pee Creek,The starting location of an Internet-famed road trip route.,39.220066,-83.112127,https://en.wikipedia.org/wiki/Pee_Pee_Creek,https://foursquare.com/v/pee-pee-creek/4e2c1ca3b61cd010837bd593?openPhotoId=5198bc4e498e2c58d8bc5b35
Poo Poo Point,The ending location of an Internet-famed road trip route.,47.500002,-122.021954,https://www.alltopsights.com/attraction-poo-poo-point-chirico-trail-washington-wa/,https://i.redd.it/40sh3spzsij11.jpg
"Gilman Hot Springs, CA",The headquarters of America's very own ultracontraversial mass cult.,33.8339,-116.9843,https://en.wikipedia.org/wiki/Gold_Base,https://upload.wikimedia.org/wikipedia/commons/8/83/Gold_Base_aerial_view_from_west.jpg
"Sarajebo, Bosnia",Archduke Franz Ferdinand was shot here and kicked off World War I.,43.8547,18.4239,https://en.wikipedia.org/wiki/Assassination_of_Archduke_Franz_Ferdinand,https://upload.wikimedia.org/wikipedia/commons/e/ea/DC-1914-27-d-Sarajevo-cropped.jpg
"Woody Creek, Colorado","The location of author Hunter S. Thompson's funeral, where his remains were shot out of a cannon by dear friend Johnny Depp.",39.2731,-106.8866,"https://en.wikipedia.org/wiki/Woody_Creek,_Colorado",https://upload.wikimedia.org/wikipedia/commons/6/67/DSCN2960_woodycreektavern_e_600.jpg
